{
  "status": "questioned",
  "evidence_assessment": "questioned",
  "prerequisites": ["The apparent guard is ineffective"],
  "confidence_explanation": "The bounded evidence leaves the guard behavior unresolved.",
  "remediation_proposal": "Confirm guard semantics before choosing a code change.",
  "verification_suggestions": ["Exercise guarded and unguarded inputs"],
  "limitations": ["No runtime behavior was supplied"],
  "uncertainty": "The guard may prevent exploitation."
}
